{
  "meta": {
    "contractVersion": "2.0",
    "exchangeId": "EX-ACCOUNTING-008",
    "sourceSystem": "1C:Retail",
    "configuration": "1С:Розница 3.0 (контракт файлового обмена)",
    "exportedAt": "2026-05-26T10:00:00Z",
    "currency": "RUB",
    "periodFrom": "2025-07-01",
    "periodTo": "2025-07-31",
    "comment": "Синтетические данные, структурно совместимые с контрактом обмена 1С:Розница. Не являются выгрузкой реальной информационной базы. Пакет 8 из 18, сценарий «accounting»."
  },
  "stores": [
    {
      "ref": "store-01",
      "code": "TT-01",
      "name": "ТТ Центральная",
      "city": "Казань",
      "format": "супермаркет",
      "isActive": true
    },
    {
      "ref": "store-02",
      "code": "TT-02",
      "name": "ТТ Заречная",
      "city": "Казань",
      "format": "у дома",
      "isActive": true
    },
    {
      "ref": "store-03",
      "code": "TT-03",
      "name": "ТТ Южная",
      "city": "Набережные Челны",
      "format": "у дома",
      "isActive": true
    },
    {
      "ref": "store-04",
      "code": "TT-04",
      "name": "ТТ Новая",
      "city": "Альметьевск",
      "format": "у дома",
      "isActive": true
    },
    {
      "ref": "store-05",
      "code": "TT-05",
      "name": "ТТ Северная",
      "city": "Казань",
      "format": "супермаркет",
      "isActive": true
    },
    {
      "ref": "store-06",
      "code": "TT-06",
      "name": "ТТ Привокзальная",
      "city": "Казань",
      "format": "киоск",
      "isActive": true
    }
  ],
  "products": [
    {
      "ref": "nomen-01",
      "sku": "MLK-1L",
      "name": "Молоко 3,2% 1 л",
      "category": "Молочная продукция",
      "unit": "шт"
    },
    {
      "ref": "nomen-02",
      "sku": "BRD-500",
      "name": "Хлеб белый 500 г",
      "category": "Хлеб",
      "unit": "шт"
    },
    {
      "ref": "nomen-03",
      "sku": "WTR-05",
      "name": "Вода питьевая 0,5 л",
      "category": "Напитки",
      "unit": "шт"
    },
    {
      "ref": "nomen-04",
      "sku": "CHS-200",
      "name": "Сыр полутвёрдый 200 г",
      "category": "Молочная продукция",
      "unit": "шт"
    },
    {
      "ref": "nomen-05",
      "sku": "APL-1KG",
      "name": "Яблоки, кг",
      "category": "Овощи и фрукты",
      "unit": "кг"
    },
    {
      "ref": "nomen-06",
      "sku": "TEA-25",
      "name": "Чай чёрный 25 пак.",
      "category": "Бакалея",
      "unit": "шт"
    },
    {
      "ref": "nomen-07",
      "sku": "CHK-1KG",
      "name": "Курица охлаждённая, кг",
      "category": "Мясо и птица",
      "unit": "кг"
    },
    {
      "ref": "nomen-08",
      "sku": "PST-450",
      "name": "Макароны 450 г",
      "category": "Бакалея",
      "unit": "шт"
    },
    {
      "ref": "nomen-09",
      "sku": "JUC-1L",
      "name": "Сок яблочный 1 л",
      "category": "Напитки",
      "unit": "шт"
    },
    {
      "ref": "nomen-10",
      "sku": "EGG-10",
      "name": "Яйцо куриное С1, 10 шт",
      "category": "Яйцо",
      "unit": "уп"
    }
  ],
  "saleDocuments": [
    {
      "ref": "accounting-doc-000741",
      "number": "ОРП-000741",
      "date": "2025-07-01",
      "storeRef": "store-02",
      "documentType": "sale",
      "lines": [
        {
          "ref": "accounting-line-0002616",
          "productRef": "nomen-03",
          "quantity": 419.0,
          "amount": 14665.0,
          "costAmount": 5751.39
        },
        {
          "ref": "accounting-line-0002617",
          "productRef": "nomen-10",
          "quantity": 182.0,
          "amount": 20930.0
        },
        {
          "ref": "accounting-line-0002618",
          "productRef": "nomen-04",
          "quantity": 86.0,
          "amount": 18060.0
        },
        {
          "ref": "accounting-line-0002619",
          "productRef": "nomen-10",
          "quantity": 126.0,
          "amount": 14490.0
        }
      ]
    },
    {
      "ref": "accounting-doc-000743",
      "number": "ОРП-000743",
      "date": "2025-07-01",
      "storeRef": "store-02",
      "documentType": "sale",
      "lines": [
        {
          "ref": "accounting-line-0002625",
          "productRef": "nomen-10",
          "quantity": 167.0,
          "amount": 19205.0,
          "costAmount": 12580.1
        },
        {
          "ref": "accounting-line-0002626",
          "productRef": "nomen-07",
          "quantity": 80.65,
          "amount": 20969.0,
          "costAmount": 15417.28
        },
        {
          "ref": "accounting-line-0002627",
          "productRef": "nomen-08",
          "quantity": 357.0,
          "amount": 27846.0,
          "costAmount": 14517.13
        }
      ]
    },
    {
      "ref": "accounting-doc-001201",
      "number": "ОРП-001201",
      "date": "2025-07-01",
      "storeRef": "store-03",
      "documentType": "sale",
      "lines": [
        {
          "ref": "accounting-line-0004218",
          "productRef": "nomen-02",
          "quantity": 503.0,
          "amount": 22635.0
        },
        {
          "ref": "accounting-line-0004219",
          "productRef": "nomen-08",
          "quantity": 150.0,
          "amount": 11700.0,
          "costAmount": 6066.68
        }
      ]
    },
    {
      "ref": "accounting-doc-001718",
      "number": "ОРП-001718",
      "date": "2025-07-01",
      "storeRef": "store-05",
      "documentType": "sale",
      "lines": [
        {
          "ref": "accounting-line-0006049",
          "productRef": "nomen-08",
          "quantity": 174.0,
          "amount": 13572.0,
          "costAmount": 6940.48
        },
        {
          "ref": "accounting-line-0006050",
          "productRef": "nomen-01",
          "quantity": 139.0,
          "amount": 12371.0,
          "costAmount": 8956.32
        },
        {
          "ref": "accounting-line-0006051",
          "productRef": "nomen-01",
          "quantity": 241.0,
          "amount": 21449.0,
          "costAmount": 15011.83
        },
        {
          "ref": "accounting-line-0006052",
          "productRef": "nomen-01",
          "quantity": 159.0,
          "amount": 14151.0,
          "costAmount": 10464.3
        }
      ]
    },
    {
      "ref": "accounting-doc-002132",
      "number": "ОРП-002132",
      "date": "2025-07-01",
      "storeRef": "store-06",
      "documentType": "sale",
      "lines": [
        {
          "ref": "accounting-line-0007522",
          "productRef": "nomen-10",
          "quantity": 34.0,
          "amount": 3910.0
        },
        {
          "ref": "accounting-line-0007523",
          "productRef": "nomen-07",
          "quantity": 27.2,
          "amount": 7072.0,
          "costAmount": 5137.48
        },
        {
          "ref": "accounting-line-0007524",
          "productRef": "nomen-05",
          "quantity": 31.6,
          "amount": 3792.0,
          "costAmount": 2293.09
        },
        {
          "ref": "accounting-line-0007525",
          "productRef": "nomen-08",
          "quantity": 90.0,
          "amount": 7020.0
        }
      ]
    },
    {
      "ref": "accounting-doc-002135",
      "number": "ОРП-002135",
      "date": "2025-07-01",
      "storeRef": "store-06",
      "documentType": "sale",
      "lines": [
        {
          "ref": "accounting-line-0007534",
          "productRef": "nomen-01",
          "quantity": 144.0,
          "amount": 12816.0,
          "costAmount": 9224.31
        },
        {
          "ref": "accounting-line-0007535",
          "productRef": "nomen-01",
          "quantity": 101.0,
          "amount": 8989.0,
          "costAmount": 6464.43
        }
      ]
    },
    {
      "ref": "accounting-doc-000742",
      "number": "ОРП-000742",
      "date": "2025-07-02",
      "storeRef": "store-02",
      "documentType": "sale",
      "lines": [
        {
          "ref": "accounting-line-0002620",
          "productRef": "nomen-08",
          "quantity": 131.0,
          "amount": 10218.0,
          "costAmount": 5287.13
        },
        {
          "ref": "accounting-line-0002621",
          "productRef": "nomen-02",
          "quantity": 268.0,
          "amount": 12060.0,
          "costAmount": 6610.67
        },
        {
          "ref": "accounting-line-0002622",
          "productRef": "nomen-04",
          "quantity": 79.0,
          "amount": 16590.0,
          "costAmount": 11188.85
        },
        {
          "ref": "accounting-line-0002623",
          "productRef": "nomen-07",
          "quantity": 44.35,
          "amount": 11531.0,
          "costAmount": 8481.17
        },
        {
          "ref": "accounting-line-0002624",
          "productRef": "nomen-05",
          "quantity": 147.35,
          "amount": 17682.0,
          "costAmount": 10422.0
        }
      ]
    },
    {
      "ref": "accounting-doc-001716",
      "number": "ОРП-001716",
      "date": "2025-07-02",
      "storeRef": "store-05",
      "documentType": "sale",
      "lines": [
        {
          "ref": "accounting-line-0006042",
          "productRef": "nomen-05",
          "quantity": 119.3,
          "amount": 14316.0,
          "costAmount": 8797.93
        },
        {
          "ref": "accounting-line-0006043",
          "productRef": "nomen-01",
          "quantity": 218.0,
          "amount": 19402.0,
          "costAmount": 13891.19
        },
        {
          "ref": "accounting-line-0006044",
          "productRef": "nomen-01",
          "quantity": 110.0,
          "amount": 9790.0,
          "costAmount": 7217.99
        },
        {
          "ref": "accounting-line-0006045",
          "productRef": "nomen-10",
          "quantity": 157.0,
          "amount": 18055.0,
          "costAmount": 12249.86
        }
      ]
    },
    {
      "ref": "accounting-doc-002133",
      "number": "ОРП-002133",
      "date": "2025-07-02",
      "storeRef": "store-06",
      "documentType": "sale",
      "lines": [
        {
          "ref": "accounting-line-0007526",
          "productRef": "nomen-05",